{
  "version": 1,
  "scenario_id": "lifecycle-compass-proof",
  "platform": "claude",
  "run_at": "2026-07-26T19:49:55Z",
  "artifact_results": [
    {
      "path": "status-line.txt",
      "passed": true,
      "detail": "ok"
    },
    {
      "path": "scenario-notes.md",
      "passed": true,
      "detail": "ok"
    },
    {
      "path": "adapter-sentinel.txt",
      "passed": true,
      "detail": "ok"
    }
  ],
  "verifier_exit_code": 0
}
